ANO_EXERCICIO;CD_GRUPO_DESPESA;DENOMINACAO_GRUPO_DESPESA;INTERPRETACAO
2025;1;PESSOAL E ENCARGOS SOCIAIS;DESPESAS ORÇAMENTÁRIAS COM PESSOAL ATIVO, INATIVO E PENSIONISTAS, RELATIVAS A MANDATOS ELETIVOS, CARGOS, FUNÇÕES OU EMPREGOS, CIVIS, MILITARES E DE MEMBROS DE PODER, COM QUAISQUER ESPÉCIES REMUNERATÓRIAS, TAIS COMO VENCIMENTOS E VANTAGENS, FIXAS E VARIÁVEIS, SUBSÍDIOS, PROVENTOS DA APOSENTADORIA, REFORMAS E PENSÕES, INCLUSIVE ADICIONAIS, GRATIFICAÇÕES, HORAS EXTRAS E VANTAGENS PESSOAIS DE QUALQUER NATUREZA, BEM COMO ENCARGOS SOCIAIS E CONTRIBUIÇÕES RECOLHIDAS PELO ENTE ÀS ENTIDADES DE PREVIDÊNCIA, CONFORME ESTABELECE O CAPUT DO ART. 18 DA LRF.
2025;2;JUROS E ENCARGOS DA DÍVIDA;DESPESAS COM O PAGAMENTO DE JUROS, COMISSÕES E OUTROS ENCARGOS DE OPERAÇÕES DE CRÉDITO INTERNAS E EXTERNAS CONTRATADAS, BEM COMO DA DÍVIDA PÚBLICA MOBILIÁRIA.
2025;3;OUTRAS DESPESAS CORRENTES;"DESPESAS COM AQUISIÇÃO DE MATERIAL DE CONSUMO, PAGAMENTO DE DIÁRIAS, CONTRIBUIÇÕES, SUBVENÇÕES, AUXÍLIO-ALIMENTAÇÃO, AUXÍLIO-TRANSPORTE, ALÉM DE OUTRAS DESPESAS DA CATEGORIA ECONÔMICA ""DESPESAS CORRENTES"" NÃO CLASSIFICÁVEIS NOS DEMAIS GRUPOS DE NATUREZA DE DESPESA."
2025;4;INVESTIMENTOS;DESPESAS COM O PLANEJAMENTO E A EXECUÇÃO DE OBRAS, INCLUSIVE COM A AQUISIÇÃO DE IMÓVEIS CONSIDERADOS NECESSÁRIOS À REALIZAÇÃO DESTAS ÚLTIMAS, E COMO A AQUISIÇÃO DE INSTALAÇÕES, EQUIPAMENTOS E MATERIAL PERMANENTE.
2025;5;INVERSÕES FINANCEIRAS;"DESPESAS ORÇAMENTÁRIAS COM A AQUISIÇÃO DE IMÓVEIS OU BENS DE CAPITAL, JÁ EM UTILIZAÇÃO; AQUISIÇÃO DE TÍTULOS REPRESENTATIVOS DO CAPITAL DE EMPRESAS OU ENTIDADES DE QUALQUER ESPÉCIE, JÁ CONSTITUÍDAS, QUANDO A OPERAÇÃO NÃO IMPORTE AUMENTO DO CAPITAL; E COM A CONSTITUIÇÃO OU AUMENTO DO CAPITAL DE EMPRESAS, ALÉM DE OUTRAS DESPESAS CLASSIFICÁVEIS NESTE GRUPO."
2025;6;AMORTIZAÇÃO DA DÍVIDA;DESPESAS COM O PAGAMENTO E/OU REFINANCIAMENTO DO PRINCIPAL E DA ATUALIZAÇÃO MONETÁRIA OU CAMBIAL DA DÍVIDA PÚBLICA  INTERNA E EXTERNA, CONTRATUAL OU MOBILIÁRIA.
2025;9;RESERVA DE CONTINGÊNCIA;A DOTAÇÃO GLOBAL DENOMINADA RESERVA DE CONTINGÊNCIA, PERMITIDA PARA A UNIÃO NO ART. 91 DO DECRETO-LEI Nº 200, DE 25 DE FEVEREIRO DE 1967 , OU EM ATOS DAS DEMAIS ESFERAS DE GOVERNO, A SER UTILIZADA COMO FONTE DE RECURSOS PARA ABERTURA DE CRÉDITOS ADICIONAIS E PARA O ATENDIMENTO AO DISPOSTO NO ART. 5º, INCISO III, DA LEI COMPLEMENTAR Nº 101, DE 2000 , SOB COORDENAÇÃO DO ÓRGÃO RESPONSÁVEL PELA SUA DESTINAÇÃO, BEM COMO A RESERVA DO REGIME PRÓPRIO DE PREVIDÊNCIA DO SERVIDOR - RPPS, QUANDO HOUVER.
