ANO_EXERCICIO;CD_FONTE;DENOMINACAO_FONTE;INTERPRETACAO
2025;94;TAXA FLORESTAL - ADMINISTRAÇÃO DIRETA;RECURSOS PROVENIENTES DA ATIVIDADE DE POLÍCIA ADMINISTRATIVA EXERCIDA PELO ESTADO NA FISCALIZAÇÃO, AUTORIZAÇÃO E LICENÇA DE INTERVENÇÃO AMBIENTAL, POR INTERMÉDIO DA SECRETARIA DE ESTADO DE MEIO AMBIENTE E DESENVOLVIMENTO SUSTENTÁVEL.
2025;95;RECURSOS RECEBIDOS POR DANOS ADVINDOS DE DESASTRES SOCIOAMBIENTAIS;RECURSOS PROVENIENTES DE COMPENSAÇÕES, INDENIZAÇÕES E RESSARCIMENTOS ORIGINÁRIOS DA OCORRÊNCIA DE DESASTRES SOCIOAMBIENTAIS.
2025;96;"
BÔNUS DE ASSINATURA DO EXCEDENTE DA CESSÃO ONEROSA PELA EXPLORAÇÃO DO PRÉ-SAL
";RECURSOS PROVENIENTES DA DISTRIBUIÇÃO DOS VALORES ARRECADADOS COM OS LEILÕES DOS VOLUMES EXCEDENTES AO LIMITE A QUE SE REFERE O § 2º DO ART. 1º DA LEI Nº 12.276, DE 30 DE JUNHO DE 2010, AUTORIZADA PELA LEI 13.885 DE 17 DE OUTUBRO DE 2019. OS VALORES SÃO PAGOS A TÍTULO DE BÔNUS DE ASSINATURA PELA EXPLORAÇÃO DO EXCEDENTE DA CESSÃO ONEROSA DO PRÉ-SAL.
2025;97;TRANSFERÊNCIAS ESPECIAIS DE RECURSOS DA UNIÃO - RECURSOS RECEBIDOS ATÉ 2023;RECURSOS TRANSFERIDOS PELA UNIÃO NA FORMA ESTABELECIDA NO INCISO I DO ART.166-A DA CONSTITUIÇÃO DA REPÚBLICA FEDERATIVA DO BRASIL DE 1988. REFERE-SE AOS RECURSOS TRANSFERIDOS PELA UNIÃO AO ESTADO ATÉ O FINAL DO EXERCÍCIO FINANCEIRO DE 2023, BEM COMO A SUAS RESPECTIVAS RESTITUIÇÕES E REMUNERAÇÕES DE DEPÓSITOS BANCÁRIOS, AINDA QUE REGISTRADAS EM EXERCÍCIOS FINANCEIROS POSTERIORES.
2025;98;TRANSFERÊNCIAS ESPECIAIS DE RECURSOS DA UNIÃO;RECURSOS TRANSFERIDOS PELA UNIÃO NA FORMA ESTABELECIDA NO INCISO I DO ART.166-A DA CONSTITUIÇÃO DA REPÚBLICA FEDERATIVA DO BRASIL DE 1988. REFERE-SE AOS RECURSOS TRANSFERIDOS PELA UNIÃO AO ESTADO A PARTIR DO EXERCÍCIO FINANCEIRO DE 2024, BEM COMO A SUAS RESPECTIVAS RESTITUIÇÕES E REMUNERAÇÕES DE DEPÓSITOS BANCÁRIOS.
2025;99;AUXÍLIO FINANCEIRO RECEBIDO DA UNIÃO PARA APLICAÇÃO EM AÇÕES DE ENFRENTAMENTO AO CORONAVÍRUS;RECURSOS PREVISTOS NO ART. 5º, INCISO I, A, DA LEI COMPLEMENTAR Nº 173/2020, DESTINADOS A AÇÕES DE ENFRENTAMENTO À COVID-19, A SEREM APLICADOS EM AÇÕES DE SAÚDE E ASSISTÊNCIA SOCIAL.
